{"$defs":{"capability":{"additionalProperties":false,"properties":{"capability_id":{"maxLength":64,"minLength":3,"type":"string"},"enabled":{"const":true},"required_for_attempt":{"const":true},"support_status":{"const":"supported"}},"required":["capability_id","enabled","required_for_attempt","support_status"],"type":"object"},"commit":{"pattern":"^[0-9a-f]{40}$","type":"string"},"component":{"additionalProperties":false,"properties":{"id":{"maxLength":64,"minLength":3,"type":"string"},"revision":{"$ref":"#/$defs/commit"},"version":{"maxLength":64,"minLength":1,"type":"string"}},"required":["id","version","revision"],"type":"object"},"digest":{"pattern":"^[0-9a-f]{64}$","type":"string"},"disabled":{"additionalProperties":false,"properties":{"automatic_updates":{"const":true},"browser":{"const":true},"dovetail":{"const":true},"honcho":{"const":true},"plugins":{"const":true},"rlm":{"const":true},"telemetry":{"const":true},"unrelated_network":{"const":true}},"required":["automatic_updates","browser","dovetail","honcho","plugins","rlm","telemetry","unrelated_network"],"type":"object"},"entry_component":{"additionalProperties":false,"properties":{"entrypoint":{"maxLength":128,"minLength":3,"type":"string"},"id":{"maxLength":64,"minLength":3,"type":"string"},"revision":{"$ref":"#/$defs/commit"},"version":{"maxLength":64,"minLength":1,"type":"string"}},"required":["id","version","revision","entrypoint"],"type":"object"},"non_evaluations":{"additionalProperties":false,"properties":{"advancement":{"const":"not_evaluated"},"application_quality":{"const":"not_evaluated"},"comparison":{"const":"not_run"},"factuality":{"const":"not_evaluated"},"feature_parity":{"const":"not_evaluated"},"hiring_outcomes":{"const":"not_evaluated"},"oracle":{"const":"not_run"},"quality":{"const":"not_evaluated"},"safety":{"const":"not_evaluated"},"scoring":{"const":"not_run"}},"required":["advancement","application_quality","comparison","factuality","feature_parity","hiring_outcomes","oracle","quality","safety","scoring"],"type":"object"},"runner":{"additionalProperties":false,"properties":{"entrypoint":{"const":"lib/recursus-route-worker-v1.mjs"},"id":{"const":"rc3-recursus-bridge-runner"},"version":{"const":"1.0.0"}},"required":["id","version","entrypoint"],"type":"object"},"string_list":{"items":{"maxLength":96,"minLength":3,"type":"string"},"maxItems":16,"minItems":1,"type":"array","uniqueItems":true}},"$schema":"https://json-schema.org/draft/2020-12/schema","additionalProperties":false,"properties":{"budgets":{"additionalProperties":false,"properties":{"max_artifact_bytes":{"const":65536},"max_output_tokens":{"const":4096},"max_provider_requests":{"const":1},"timeout_ms":{"maximum":600000,"minimum":1000,"type":"integer"}},"required":["max_artifact_bytes","max_output_tokens","max_provider_requests","timeout_ms"],"type":"object"},"capabilities":{"items":{"$ref":"#/$defs/capability"},"maxItems":8,"minItems":8,"type":"array","uniqueItems":true},"contract_version":{"const":"rc3-recursus-direct-v1"},"corpus":{"additionalProperties":false,"properties":{"corpus_version":{"const":"career-bench-v1"},"scenario_id":{"const":"FACT-01"}},"required":["corpus_version","scenario_id"],"type":"object"},"deviations":{"$ref":"#/$defs/string_list"},"environment":{"additionalProperties":false,"properties":{"node":{"const":"^22.19.0 || >=24.0.0"},"platforms":{"items":{"enum":["linux-x64","windows-x64"]},"maxItems":2,"minItems":2,"type":"array","uniqueItems":true}},"required":["node","platforms"],"type":"object"},"expected_evidence":{"additionalProperties":false,"properties":{"artifact_path":{"const":"artifacts/assistant-output.md"},"output_contract":{"const":"one_bounded_tailored_summary_markdown"},"request_sha256":{"$ref":"#/$defs/digest"}},"required":["artifact_path","output_contract","request_sha256"],"type":"object"},"milestone":{"const":"RC-3"},"non_evaluations":{"$ref":"#/$defs/non_evaluations"},"permissions":{"additionalProperties":false,"properties":{"browser":{"const":"disabled"},"evidence":{"const":"runner_only_external"},"external_apps":{"const":"disabled"},"network":{"const":"registered_adapter_actual_only"},"provider":{"const":"one_registered_request_actual_only"},"workspace":{"const":"read_only_seed"}},"required":["workspace","evidence","network","provider","browser","external_apps"],"type":"object"},"policies":{"additionalProperties":false,"properties":{"credential_values":{"const":"runtime_managed_never_captured"},"disabled_features":{"$ref":"#/$defs/disabled"},"dry_run_offline":{"const":true},"oracle_evaluation":{"const":"not_run"},"validation_offline":{"const":true}},"required":["dry_run_offline","validation_offline","credential_values","oracle_evaluation","disabled_features"],"type":"object"},"registered_at":{"maxLength":32,"minLength":20,"type":"string"},"registration_id":{"const":"RC3-REC-DIRECT-2026-08-24-V1"},"route":{"additionalProperties":false,"properties":{"adapter":{"additionalProperties":false,"properties":{"entrypoint":{"const":"lib/index.js"},"id":{"const":"deepseek-openai-codex"},"revision":{"$ref":"#/$defs/commit"},"transport":{"const":"direct_adapter"},"version":{"const":"0.1.0"}},"required":["id","version","revision","entrypoint","transport"],"type":"object"},"control_plane":{"$ref":"#/$defs/entry_component"},"credential_reference":{"const":"OPENAI_CODEX_OAUTH"},"harness":{"$ref":"#/$defs/component"},"model":{"additionalProperties":false,"properties":{"id":{"const":"gpt-5.6-sol"},"reasoning_effort":{"const":"xhigh"},"snapshot":{"const":"gpt-5.6-sol"},"snapshot_representation":{"const":"configured_catalog_model_id"}},"required":["id","snapshot","snapshot_representation","reasoning_effort"],"type":"object"},"provider":{"additionalProperties":false,"properties":{"id":{"const":"openai-codex"},"provider_reported_model":{"const":"not_reported"}},"required":["id","provider_reported_model"],"type":"object"},"route_id":{"const":"recursus-direct-v1"},"runner":{"$ref":"#/$defs/runner"},"runtime":{"$ref":"#/$defs/component"}},"required":["route_id","runtime","harness","control_plane","runner","provider","adapter","model","credential_reference"],"type":"object"},"schema_version":{"const":"1.0"},"source_snapshot":{"additionalProperties":false,"properties":{"path":{"const":"source-snapshot.json"},"snapshot_id":{"const":"RC3-SOURCE-SNAPSHOT-2026-08-24-V1"}},"required":["path","snapshot_id"],"type":"object"},"synthetic":{"const":true},"unsupported_capabilities":{"$ref":"#/$defs/string_list"}},"required":["schema_version","registration_id","contract_version","registered_at","milestone","synthetic","corpus","route","environment","permissions","policies","budgets","capabilities","deviations","unsupported_capabilities","non_evaluations","expected_evidence","source_snapshot"],"type":"object"}
