{"budgets":{"max_artifact_bytes":65536,"max_output_tokens":4096,"max_provider_requests":1,"timeout_ms":120000},"capabilities":[{"capability_id":"accepted_seed_ingestion","enabled":true,"required_for_attempt":true,"support_status":"supported"},{"capability_id":"bounded_output_capture","enabled":true,"required_for_attempt":true,"support_status":"supported"},{"capability_id":"bridge_input_construction","enabled":true,"required_for_attempt":true,"support_status":"supported"},{"capability_id":"content_safe_trace","enabled":true,"required_for_attempt":true,"support_status":"supported"},{"capability_id":"direct_adapter_transport","enabled":true,"required_for_attempt":true,"support_status":"supported"},{"capability_id":"independent_validation","enabled":true,"required_for_attempt":true,"support_status":"supported"},{"capability_id":"normalization","enabled":true,"required_for_attempt":true,"support_status":"supported"},{"capability_id":"runner_manifest","enabled":true,"required_for_attempt":true,"support_status":"supported"}],"contract_version":"rc3-recursus-direct-v1","corpus":{"corpus_version":"career-bench-v1","scenario_id":"FACT-01"},"deviations":["RC3-DEV-MINIMAL-BRIDGE-INPUT","RC3-DEV-NONDURABLE-SINGLE-ATTEMPT","RC3-DEV-ONE-BOUNDED-SUMMARY"],"environment":{"node":"^22.19.0 || >=24.0.0","platforms":["linux-x64","windows-x64"]},"expected_evidence":{"artifact_path":"artifacts/assistant-output.md","output_contract":"one_bounded_tailored_summary_markdown","request_sha256":"420f7b18d8213eaba5e462085acfa1d0f84162e43f77502ad2422fa9c5766317"},"milestone":"RC-3","non_evaluations":{"advancement":"not_evaluated","application_quality":"not_evaluated","comparison":"not_run","factuality":"not_evaluated","feature_parity":"not_evaluated","hiring_outcomes":"not_evaluated","oracle":"not_run","quality":"not_evaluated","safety":"not_evaluated","scoring":"not_run"},"permissions":{"browser":"disabled","evidence":"runner_only_external","external_apps":"disabled","network":"registered_adapter_actual_only","provider":"one_registered_request_actual_only","workspace":"read_only_seed"},"policies":{"credential_values":"runtime_managed_never_captured","disabled_features":{"automatic_updates":true,"browser":true,"dovetail":true,"honcho":true,"plugins":true,"rlm":true,"telemetry":true,"unrelated_network":true},"dry_run_offline":true,"oracle_evaluation":"not_run","validation_offline":true},"registered_at":"2026-08-24T12:00:00.000Z","registration_id":"RC3-REC-DIRECT-2026-08-24-V1","route":{"adapter":{"entrypoint":"lib/index.js","id":"deepseek-openai-codex","revision":"5232102d0cc8bd55d5bf27b6eb203efbf6ada8a9","transport":"direct_adapter","version":"0.1.0"},"control_plane":{"entrypoint":"@deepseek-ai/dsh-agent-loop","id":"deepseek-harness","revision":"e52c224fe00954fb7e8cda19eb2411dceef15989","version":"dsh-v0.1.0-rc.7"},"credential_reference":"OPENAI_CODEX_OAUTH","harness":{"id":"recursus-rc3-minimal-harness","revision":"4444405e8b34124b1518fa2a66d0223e202234e4","version":"1.0.0"},"model":{"id":"gpt-5.6-sol","reasoning_effort":"xhigh","snapshot":"gpt-5.6-sol","snapshot_representation":"configured_catalog_model_id"},"provider":{"id":"openai-codex","provider_reported_model":"not_reported"},"route_id":"recursus-direct-v1","runner":{"entrypoint":"lib/recursus-route-worker-v1.mjs","id":"rc3-recursus-bridge-runner","version":"1.0.0"},"runtime":{"id":"recursus","revision":"4444405e8b34124b1518fa2a66d0223e202234e4","version":"0.0.0-foundation"}},"schema_version":"1.0","source_snapshot":{"path":"source-snapshot.json","snapshot_id":"RC3-SOURCE-SNAPSHOT-2026-08-24-V1"},"synthetic":true,"unsupported_capabilities":["ablations","compiled_prompt_parity","durable_execution_and_recovery","full_career_ops_feature_parity","honcho_enhancements","human_evaluation_and_scoring","recursus_only_enhancements","rlm_enhancements"]}
